,english,yoruba
1435,Visitors to their house breathed the smell of fresh flowers and were full of for the lady of the house.,"Àwọn àlejò tó bá wá sí ilé wọn máa ń gbóòórùn òdòdó tútù, wọn sì máa ń kan sárá sí ìyá-ilé náà."
1436,Labake was grand style - so it seemed pleased.,Èyí tẹ́ Làbákẹ́ lọ́rùn.
1437,The matrimonial home had taken off in.,Ilé ọkọ náà ti bẹ̀rẹ̀ ní ara ọ̀tọ̀ bí ó ṣe jọ.
1438,But was that truly a home?,"Ṣùgbọ́n, ṣe ilé nìyẹn?"
1439,Labake was later compelled to begin asking herself.,Làbákẹ́ padà bẹ̀rẹ̀ si í tún ara rẹ̀ bi.
1440,"Was she not merely decorating a house, instead of building a home?","Ṣé kì í ṣe pé ó kàn dára sí ilé lásán ni, kàkà kí ó fi kọ́ ilé?"
1441,It did not take Labake a long time to realize that building a good matrimonial home was more than merely furnishing and decorating the rooms of a building.,Kò pẹ́ kí ó tó yé Làbàkẹ́ pé kíkó ilé ọkọ ẹni ju títò àti dídárà si àwọn yàrá ilé lọ.
1442,"The real home was made up of people - husband and wife interacting intimately with each other, loving each other, planning together, looking ahead to the future with hope and optimism.","Ilé gidi ni àwọn ènìyàn – ọkọ àti ìyàwó tí wọn ń bá ara wọn sọ̀rọ̀ tímọ́-tímọ́, tí wọn nífẹ̀ẹ́ ara wọn, tí wọn jọ ń ṣètò, tí wọ́n jọ ń wo ọjọ́ iwájú pẹ̀lú ìrètí àti ìgbàgbọ́ pé ohun gbogbo á dára."
1443,The real matrimonial home was made of human beings with human feelings.,Ilé ọkọ gidi kún fún ènìyàn àti ìmọ̀lára ènìyàn.
1444,Not the building - wall and roof.,Kì í ṣe ilé lásán – òrùlé àti ògiri.
1445,"Not the hypocritical decoration of the rooms, Labake now knew.","Kì í ṣe bí á ṣe dára sí àwọn yàrá, Làbákẹ́ ṣẹ̀ṣẹ̀ mọ̀."
1446,She clutched her small handbag firmly under her and walked out into the street hailing a taxi.,"Ó fi báàgì ìkọ́pá rẹ̀ sábẹ́ apá rẹ̀ ó sì rìn wọ òpòpónà náà, tí ó ń pé kabúkabú."
1447,"It did not take her long, this time, to get to Oke-Ado.","Kò pẹ ẹ́, lásìkò yìí, kí ó tó dé Òkè-Àdó."
1448,"Although the short-cut was still impassable, a of work had been done by the government on the long Agbeni Ogunpa road.","Bí ó tilẹ̀ jẹ́ pé, ọ̀nà àbùjá ò tí ko ṣe é gbà, ọ̀pọ̀lọpọ̀ iṣẹ́ ni ìjọba ń ṣe ní títì Agbeni sí Ògùnpa gígùn yẹn."
1449,Some discipline was injected into the danfo and taxi drivers and the war against indiscipline with the street had been waged and won too.,"Àwọn òfin ìkóni-níjàánu kan ti wọ ara àwọn awakọ̀ dánfó àti kabúkabú, àti ogun tí wọn dàkọ, àíní-ikora-ẹni-nìjàánu àwọn ọlọ́jà òpòpónà tí ó ti ṣe."
1450,They all feared the new decree soon to be enforçed by the government.,Gbogbo wọn ni wọ́n bẹ̀rù òfin tuntun tí àwọn ìjọba fẹ́ fi lẹ́lẹ̀ láìpẹ́.
1451,"Any, driver who parked his vehicle wrongly would be summarily dealt with by the mobile courts; any driver who caused a traffic hold-up' would also be handed over to the courts and for traders who engaged in street trading, stiff penalties awaited them.","Awakọ̀ kí awakọ̀ tó bá gbé ọkọ̀ rẹ̀ sọ́nà lọ́nà àìtọ́ á fojú winá ní àwọn ilé ẹjọ́ alágbèéká; awakọ̀ to bá dá “súnkẹrẹ-fàkẹrẹ” ọkọ̀ sílẹ̀, wọn á fà á lé ilé-ẹjọ́ lọ́wọ́; àwọn ọlọ́jà tí ó bá tajà ní òpópónà, ìjìyà tí ó le ń dúró dè wọ́n."
1452,"So now, the street was clear and driving on Agbeni Ogunpa road, like every other road of the city, was becoming more and more pleasurable.","Ní báyìí, òpòpónà wá mọ́ féfé, wíwakọ̀ lópòópónà Agbeni Ògùnpa wá ń dùn mọ́ bí i tí àwọn títì mìíràn nílùú ńlá."
1453,Soon Labake was in her lawyers' chambers.,"Láìpẹ́,  Làbákẹ́ ti dé ìyẹ̀wù àwọn agbejọ́rò."
1454,The environment in the chambers no longer scared her.,Àyíká ìyẹ̀wù náà kì í bà á lẹ́rù mọ́.
1455,It had become familiar to her now.,Ó tí mọ́ ọn lára.
1456,The panic and the anxiety which gripped her during her first visit had completely disappeared.,Ìpayà àti àìbalẹ̀ ọkàn tí ó gbá a mú nígbà àkọ́kọ́ tí ó máa dé ibẹ̀ ti pòórá pátápátá.
1457,She felt at ease now as she spoke freely with the friendly receptionist.,Ara rẹ̀ balẹ̀ báyìí bí ó ṣe ń bá olùgbàlejò iléeṣẹ́ náà sọ̀rọ̀.
1458,"""You are lucky today madam', the receptionist said, presenting a smile.","“Ẹ ṣoríire lónìí màdáámú”, olùgbàlejò náà sọ̀rọ̀ pẹ̀lú ẹ̀rín músẹ́ lẹ́nu,"
1459,"""Yes, lucky. He's in', ""Really?","“Bẹ́ẹ̀ ni, ẹ mọ̀ ọ́n rìn. Wọ́n wà nínú ilé”. “Ṣé lóòótọ́?”"
1460,"Yes, Then I am lucky, ""You are indeed madam.","“Bẹ́ẹ̀ ni”, “Mo ṣoríire nìyẹn”, “Lóòótọ́ ni màdáámú."
1461,But you'll have to wait for a few minutes.,Ṣùgbọ́n ẹ ní láti dúró fún bí i ìṣẹ́jú díẹ̀.
1462,There's somebody in there with him him'.,Ẹnìkan wà pẹ̀lú wọn”.
1463,"Thank you, I'll wait'.","“Ẹ ṣeun, màá dúró”."
1464,This was Labake's fourth visit to the chambers.,Èyí ni ìgbà ẹ̀ẹ̀kẹ́rin tí Làbákẹ́ ti ṣe àbẹ̀wò sí ìyẹ̀wù náà.
1465,"She had not been lucky since her first visit, to meet any of the two lawyers.","Kò ní àǹfààní láti bá wọn, yàtọ̀ sí ìgbà àkọ́kọ́, kí ó bá ìkankan nínú àwọn agbẹjọ́rò méjèèjì."
1466,"At various times, she had been told they were out.",Ní ọ̀pọ̀ ìgbà wọ́n ti sọ fún un pé wọ́n jáde.
1467,At one time she was told Lawyer Mustafa had gone on a business trip overseas.,"Nígbà kan, wọ́n sọ fún un pé agbẹjọ́rò Mústàfá ti lọ fún ìrìnàjò òwò lókè-òkun."
1468,Labake was not surprised to hear that.,Kò ya Làbákẹ́ lẹ́nu láti gbọ́ ìyẹn.
1469,She remembered he had dropped a hint to that effect the other time.,Ó rántí pé ó ti sọ nǹkan tí ó jọ èyí ní ìgbàtí órí iyẹn.
1470,"He said he would make a trip to England or, was it to America?","Ó ní òun á rìn ìrìnàjò lọ sí Englandi, Àbí ṣé Amẹ́ríkà ni?"
1471,"During another visit, she was told that Lawyer Mustafa's partner had gone to argue a case in a Lagos Court.","Ní ìgbà àbẹ̀wò mìíràn, wọ́n sọ fún un pé ìkejì agbẹjọ́rò Mústàfá ti lọ ṣe àwíjàre ẹjọ́ kan ní ilé-ẹjọ́ Èkó."
1472,During Labake's last visit to chambers she met the lawyers' confidential secretary who assured her that action had started on her case.,"Nígbà àbẹwò ìgbẹ̀yìn Làbákẹ́ sí ibẹ̀, ó pàdé akọ̀wé àṣírí àwọn agbẹjọ́rò náà, tí ó fi í lọ́kàn balè pé iṣẹ́ti bẹ̀rẹ̀ lórí ẹjọ́ rẹ̀."
1473,"The case had been registered, and its strategy mapped out by the lawyers.","Wón ti ṣe àkọsílè ẹjọ́ rẹ̀, ọ̀nà àti ṣiṣẹ́ rẹ̀ sì ti jáde."
1474,"The wedding album, the marriage ring and the certificate she brought had been inspected and would be tendered in court as exhibits.","Ìwé àkójopọ̀ àwòrán ìgbéyàwó, òrùka ìgbéyàwó, àti ìwé-ẹ̀rí ìgbéyàwó tí ó mú wá ni wọ́n ti yẹ̀wò fínní fínní, wọn á sì fi hàn nílé ẹjọ́ gẹ́gẹ́ bí ẹ̀rí."
1475,Labake had listened in rapt attention.,Làbákẹ́ ti tẹ́tí pẹ̀lú ìfọkànsí.
1476,"What remained for her, the secretary said, was to formally meet any of the two lawyers for a brief chat.","Ohun tí ó kù fún un tí akọ̀wé náà sọ ni pé, kí ó pàdé ọ̀kan lára àwọn agbẹjọ́rò méjèèjì fún ìtàkùrọ̀sọ ráńpé."
1477,"Then they would quickly file the suit, issue a court summons to her husband, and prepare to go to court to argue the case.","Lẹ́yìn náà ni wọ́n á gbé ẹjọ́ náà lọ ilé-ẹjọ́, tí wọ́n á fi ìwé ìpèlẹ́jọ́ ráńṣ́ẹ́ sí ọkọ rẹ̀, wọn á sì gbaradì láti lọ sí ilé-ẹjọ́ láti ṣe àwíjàre ẹjọ́ náà."
1478,"The confidential secretary had assured her that her case was going to be very easy to prosecute, compared with the other naughty ones the lawyers handled.","Akọ̀wé àṣírí náà fi í lọ́kàn balẹ̀ pé ẹjọ́ rẹ̀ á rọrùn láti gbá mú, ó yàtọ̀ sí àwọn ẹjọ́ gbẹ̀ ẹ́ gbẹ̀ ẹ́, tí àwọn agbẹjọ́rò náà ti gbá mú."
1479,Hers would be quickly disposed of in not more than two proceedings.,Wọn átètè parí tirẹ̀ ní ìjókòó ẹ̀ẹ̀mejì.
1480,"Now Labake was lucky, She would hear it all from the horse's mouth.","Ní báyìí, oríti bá Làbákẹ́ ṣe é, Á gbọ́ ọ̀rọ̀ lẹ́nu ọlọ́rọ̀."
1481,"Lawyer Mustafa's partner was in, and she was shortly going to meet him over the matter.","Ìkejì agbẹjọ́rò Mústàfá wà nínú ilé, á sì lọ bá a láìpẹ́ lórí ọ̀rọ̀ náà."
1482,She would be meeting this second lawyer for the first time.,Á pàdé agbẹjọ́rò kejì yìí fún ìgbà àkọ́kọ́.
1483,"The friendly receptionist kept her at ease, talking intimately to her.","Olùgbàlejò tó kóni mọ́ra náà fi í lára balẹ̀, ó ń bá a sọ̀rọ̀ tímọ́tímọ́."
1484,"""How are the children?",“Àwọn ọmọ náà ńkọ́?”
1485,"""Thank you.",“Ẹ ṣeun”
1486,"""And their father, madam?","“Àti bàbá wọn, màdáámú?”"
1487,"Fine, thank you', What else would Labake say?","“Wọ́n wà dáadáa, ẹ ṣeun”, Kí tún ni kí Làbákẹ́ sọ?"
1488,Her eyes wandered. Everybody with their own problems.,Ojú rè wò. rá-rà-rá oníkálùkù pẹ̀lú ìṣòro tirẹ̀.
1489,"Tinu's father was alright, would she say he was not alright?","Bàbá Tinú wà lálàáfíà, àbí ṣe yóò sọ pé kò sí lálàáfíà ni?"
1490,Labake's eyes caught the gold watch twinking on the wrist of the receptionist.,Ojú Làbákẹ́ rí aago ọ̀rún-ọwọ́ wúrà tí ó ń kọ mọ̀nà lọ́rùn ọwọ́ olùgbàlejò náà.
1491,She noted the phosphore scent glow of its tiny hands.,Ó ṣàkíyèsí ọwọ́ aago náà tí ó ń tàn.
1492,This was an opportunity for her to change the topic of discussion over to some general things.,Èyí jẹ́ àǹfàànì fún un láti yí kókó ọ̀rọ̀ wọn padà sí nǹkan gbogbo ògbò.
1493,"""You have a fine wrist-watch', Labake observed. addressing the receptionist, ""Newly purchased, I suppose?""","“Ẹ ní aago ọrùn-ọwọ́ tó rẹwà”, Làbákẹ́ sọ èyí, ó ń bá olùgbàlejò náàwí, “Tuntun ni, àbí?”"
1494,"Yes, madam.","“Bẹ́ẹ̀ ni, màdáámú."
1495,Bought only two months ago.,Oṣù méjì sèyín la rà á.
1496,We got it in Washington during our honeymoon.,"Ìlú Washington la ti rà á, nígbà ìgbádùn àṣẹ̀ṣẹ̀ṣe ìgbéyàwó."
1497,My husband has a similar one.,Ọ̀ko mi náàní irú ẹ̀.
1498,"You see, we are always purchasing things together.","Ṣéẹ rí i, a jọ máa ń ra nǹkan papọ̀ ni."
1499,Buy a blouse and he would want a shirt!,"Bí mo bá ra búláòsì, òun náà á fẹ́ ṣẹ́ẹ̀tì!"
1500,Buy a shirt and he too would want a pair of trousers.,Bí mo ra ṣẹ́ẹ̀tì kan òun náà á fẹ́ ṣòkòtò kan.
1501,"Buy a wig and, oh my God! Dapo would want a hat!","Bí mo bá ra irun aláwọ̀sórí, Olúwa ò! Dàpọ̀ náàá fẹ́ fìlà”."
1502,I see. That's good'.,”Mo rí i. Ó dáa bẹ́ẹ̀”
1503,Thank you madam.,“Ẹ ṣeun màdáámú.
1504,We intend to go back at the end of the year to do some more shopping,À ń gbèrò láti padà lọ ní òpin ọdún yìí láti lọ ra àwọn nǹkan sí i.
1505,America is so beautiful.,Ìlú Amẹ́ríkà mà rẹwà.
1506,Lots and lots of beautiful things to purchase.,Ọ̀pọ̀lọpọ̀ nǹkan tó rẹwà ni ó wà láti rà.
1507,"Lots of nice, nice people to meet.""",Ọ̀pọ̀lọpọ̀ àwọn èèyàn dáadáa dáadáa ló wà níbẹ̀ láti pàdé”
1508,"That's right, In happier times, Labake would have told the receptionist that she too was not a stranger to Uncle Sam's country.","“Òótọ́ ni”, Kání àsìkò tí inú rẹ̀ dùn ni,  Làbákẹ́ ò bá sọ fún olùgbàlejò náà pé òun náà kì í ṣe àjèjì sí ilẹ̀ aláwọ̀ funfun."
1509,"That she had made several visits to America from Britain, and had toured the great cities extensively.","Kò bá so ó pé òun ti ṣe àìmọye àbèwò sí Amẹ́ríkà láti Brítéènì, ó sì ti dé gbogbo ìlú ńlá náà."
1510,"She was in Philadelphia, Los Angeles and San Francisco, New Orleans and Chicago.","Ó lọ sí Philadelphia, Los Angeles àti San Francisco; New Orleans àti Chicago."
1511,"Yes, during happier times, Labake would have lectured the receptionist, thoroughly, on where to go in America for shopping the shoppers paradise on Madison Avenue in New York the great Neiman Marcus in Washington DC and the mighty Water Tower Complex – the pride of Chicago.","Bẹ́ẹ̀ ni, nígbà tí inú rẹ̀ ń dùn,  Làbákẹ́ ò bá ti ṣe ìdánilẹ́kọ̀ọ́ tó péye fún olùgbàlejò náà lórí àwọn ibi tí ó lè lọ ní Amẹ́ríkà tíó bá fẹ́ ra nǹkan – párádísè àwọn òǹràjà ni òpópónà Madison ní New York, Neiman Marcus ńlá ní Washington DC àti Tower complex olómí ńlá – tí ó jẹ́ ẹwà Chicago."
1512,The situation now was quite different.,Ọ̀rọ̀ tó wà nílẹ̀ nísinsìnyí yàtọ̀
1513,"""America is beautiful the receptionist repeated, her eyes shining bright.","“Amẹ́ríkà rẹwà” olùgbàlejò náà tún un sọ, tí ojú rẹ̀ ń dán."
1514,Labake sized her up quickly. This was one of the travelers to the States who would arrive back at home full of pride at having the rare privilege of visiting civilized America.,Làbákẹ́ gbé e léwòn kíákíá. Èyí jẹ́ ọ̀kan lára àwọn arìnrìnàjò lọ sí “ìlú ọba” tí ìgbéraga máa ń wọ̀ lẹ́wù tí wọ́n bá padà dé ilé nítorí wọ́n ti jàjà ní àǹfààní àtilọ sí ìlú Amẹ́ríkà tí wọ́n ti lajú.
1515,"Their two month, or so visit would take them to the state capitals, they would see the glittering street lights and the multiple-carriage highways and then rush back home to talk of beautiful America, mere casual visitors who knew nothing about the ghetto areas in Uncle Sam's country!","Àbẹ̀wò oṣù méjì àbí kínla wọn máa ń mú wọn lọ sí olú-ìlú; wọn á ri àwọn iná òpópónà tí ó ń dán àti òpópónà àìmọye, wọn á wá sáré wálé láti sọ̀rọ̀ “ẹwà Amẹ́ríkà”, àwọn àlejò lásán làsàn tí ò mọ nǹkankan nípa àwọn àdúgbó tí ò ṣe é fojú rí ní ìlú òyìnbó."
1516,Labake's eyes rested on the sparkling ornament on the receptionist's finger - her wedding ring.,Ojú Làbákẹ́ lọ sí ibi ohun ọ̀ṣọ́tó ń danná ní ìka ọwọ́ olùgbàlejò náà – òrùka ìgbéyàwó rẹ̀ .
1517,She was newly- married truly!,Ó ṣẹ̀ṣẹ̀ ṣe ìgbéyàwó ni lóòótọ́!
1518,"No wonder her face radiated happiness, and she became talkative.",Abájo tí ìdùnnú ṣe kún ojú rẹ̀ tí ó wá di ẹlẹ́jọ́ wẹ́wẹ́.
1519,No wonder she was so full of life.,Abájọ tí ìyè fi kún inú rẹ̀.
1520,Labake saw a lover's chain dangling from her neck.,Làbákẹ́ rí ṣéènì olólùfe tí ó ń mì lọ́rùn rẹ̀.
1521,"""You missed seeing my husband, the Receptionist continued, her mouth would not be stopped!","“Ẹtàsé rírí ọkọ mi”, olùgbàlejò náà tẹ̀síwájú, ẹnu rẹ̀ kò ṣe é dá dúró!"
1522,"You missed him just by a few minutes madam, he just left after teasing me crazy, and promising he would come back to pick me on the dot of three thirty.","“Ẹ tàsé rẹ̀ fún bí i ìṣẹ́jú díẹ̀ màdáámú, ó lọ lẹ́yìn ìgbà tí ó fẹ́rẹ̀ ẹ́ lè fìfẹ́ yí mi lórí, ó sì ṣèlérí láti wá gbé mi ní aago mẹ́ta ààbọ̀ gérégé."
1523,"You see, madam, I have a jealous man for a husband.","Ṣe ẹ rí i, màdáámú, òjòwú ọkùnrin ni mo ní lọ́kọ."
1524,Dapo can't stand me uing a minute over-time work here.,Dàpọ̀ ò lè gbà láti rí i pé mo ṣe ìṣẹ́jú kan ní àsìkò èlé iṣẹ́ níbi.
1525,Won't allow to go out alone.,Kò ní í jẹ́ kí n dájáde.
1526,"And would always tell me, ok darling, what God has joined together, let no one put asunder'","Á máa sọ ọ́ ní gbogbo ìgbà pé “wò ó olólùfẹ́, ohun tí Ọlọ́run Ọba báti so pọ̀, kí ẹnikẹ́ni má ṣe tú u ká”"
1527,"Then, pull at my cheeks tenderly, cling on to me as if somebody, close at hand, would snatch me from him any minute.","Lèyín  náà, á fà mí lẹ́rẹ̀kẹ́ jẹ́jẹ́, á wá lẹ̀ mọ́ mi, bí ìgbà tí ènìyàn kan bá wà nítòsí tó fẹ́ gbà mí mọ́ ọn lọ́wọ́ nígbàkugbà."
1528,"Labake looked away, she shifted uncomfortably on the chair.","Làbákẹ́ gbójú kúrò, ó sún pèlú ìnira lórí ìjókòó."
1529,She was already becoming envious of this receptionist in obvious connubial elation.,Ó ti ń jowu olùgbàlejò yìí pẹ̀lú ìgbéraga àti ayọ̀ tó farahàn.
1530,"Her what God has joined together jerked her brain to a state of insensibility, and the let no man put asunder pricked her in the mind like a thorn.","Ọ̀rọ̀ “Ohun tí Ọlọ́run Ọba ti so pọ̀” rẹ̀ wọ ọpọlọ rẹ̀ débi ipò àìlọ́pọlọ, tí “kí ẹnikẹ́ni má ṣe yà wọ́n” rẹ̀ gún un lọ́kàn bí ẹ̀gún."
1531,"Surely, that was not the first time she would hear the expression, it was a hackneyed expression.","Dájúdájú, kìí ṣe ìgba àkọ́kọ́ tí yóò gbọ́ ọ̀rọ̀náà nìyen, ó jẹ́ ọ̀rọ̀ tí kò ṣàjèjì."
1532,"She'd heard it a thousand and one times, but to be reminded of it at this point in time was enough to make the heart pound violently as if under the weight of a sledge hammer.","Ó ti gbọ́ ọ nígbà mọ́kànlélẹ́gbẹ̀rún, ṣùgbọ́n kí wọ́n rán an létí nínú àsìkò yìí tó láti mú kí ọkàn rẹ̀ máa lù kì-kì-kì bí ìgbà tí wọ́n fòlù lù ú."
1533,"Very soon, the inner door of the chambers opened, and a fat man in agbada left the lawyers' office.","Láìpẹ́, ìlẹ̀kùn inú ìyẹ̀wú náàṣí sílè, ọkùnrin sísanra kan tí ó wọ agbádá kúrò ní ọ́fíìsì agbẹjọ́rò."
1534,"Labake was ushered in and in a minute, found herself face to face with the man who would help her put asunder what God has joined together - Lawyer Mustafa's partner.","Wọ́n pe Làbákẹ́ wọlé ní ìsẹ́jú kan, ó sì bá ara rẹ̀ níwájú ọkùnrin tí yóò bá a tú ohun tí Ọlọ́run ti so pọ̀ ká – ìkejì agbẹjọ́rò Mústàfá."
1535,Come right in madam.,“Ẹ wọlé síbí màdáámú.
1536,Feel free.,Ẹtúra ká.
1537,Take a chair,Ẹ mú ìjókòó.
1538,"You are welcome, the lawyer in grey suit and dark glasses addressed her","Ẹ káàbọ̀”, agbẹjọ́rò tí ó wọ súùtù aláwò eérú, tí ó sì kan ìgò dúdú mọ́jú, bá a wí."
1539,"""You are Mrs. Alamu Olaoye?",“Ẹ̀yin ni ìyáàfin Àlàmú Ọláoyè?”
1540,"Yes... Yes... Yes, At least for now madam?","“Bẹ́ẹ̀ ni... bẹ́ẹ̀... bẹ́ẹ̀ ni, “Fún ìsìnyí màdáámú?”"
1541,Yes. Thank you.,“Bẹ́ẹ̀ ni. Ẹ ṣeun”
1542,"""I am handling your case, is that alright with you?","“Èmi ni ẹjọ́ yín wà ní ìkáwọ́ rẹ̀, ṣé ó tẹ́ ẹ yín lọ́rùn?”"
1543,"""Yes, You want a divorce?","“Bẹ́ẹ̀ ni”, “Ẹ́ fẹ́ kọ ọkọ yín sílẹ̀?”"
1544,"""Yes"". My partner has given me all the details.",“Bẹ́ẹ̀ ni”. “Ẹnìkejì mi ti fún  mi ní ẹ̀kúnrẹ́rẹ́ àlàyé.
1545,Your tape recorded statement is also here.,Ohùn yín tí a gbà sílẹ̀ náà wà níbí.
1546,You have anything more to add to what you've already told,Ṣe ẹ ò ní nǹkan tí ẹ fẹ́ fi kún àwọn nǹkan tíẹ ti sọ fún wa?”
1547,No. Nothing. No em...,“Rárá. Kò sí nǹkankan. Rárá ẹm ...”
1548,Come madam. Speak up. Well.,“Màdáámú ẹ wá. Ẹ sọ̀rọ̀ sókè. Dáadáa.”
1549,Except... Except that... that I want the case disposed of as quickly as em.. em.,“Ẹnnn ...yàtọ̀ sí pé mo fẹ́ kí ẹjọ́ náà yanjú ni kòpẹ́ kòpẹ́ yìí ẹm..ẹm.”
1550,Can understand your anxiety madam.,“Ó yé mi bí o ṣe ń ṣe yín màdáámú.
1551,We are ready at our end here.,A ti ṣetán ní ọ̀dọ̀ wa níbí.
1552,No problem.,Kò sí ìṣòro.”
1553,"Thank you, I want the case settled quickly because.","“Ẹ ṣeun, mo fẹ́ kí ẹjọ́  náà tètè níyanjú kíákíá nítorí pe.”"
1554,"Yes, madam. Feel free... Because?","“Bẹ́ẹ̀ ni, màdáámú. Ẹ túra ká... Nítorí pé?”"
1555,"Because, this man can harm me any time.""",“Nítorí pé ọkùnrin yìí lè pamí lára nígbàkúùgbà”
1556,Is that so?,“Ṣé lóòótọ́?”
1557,"""Yes, he is now out of his mind. He had gone mad...","“Bẹ́ẹ̀ ni, orí rẹ̀ ti yí. Ó ti ya wèrè...”"
1558,Tell me! OK.,“Ẹ sọ fún mi! ó dáa.
1559,"Don't worry madam, tomorrow we go to court.","Ẹ má ṣèyọnu màdáámú, tó bá dọ̀la à á lọ sílé ẹjọ́."
1560,How about that?,Ìyẹn ńkọ́?
1561,Do you like it that way?,Ṣé ẹ fẹ́ ẹ́ bẹ́ẹ̀?”
1562,"""Thank you very much.",“Ẹ ṣeun gan an ni.
1563,"That is what I want.""",Nǹkan tí mo fẹ́ nìyẹn.”
1564,"""You are happy now Mrs. Olaoye?",“Ṣé inú yín ti dùn báyìí ìyáàfin Ọláoyè?”
1565,"""Yes. Yes. Labake could not understand why she felt so shy in the presence of the lawyer.",“Bẹ́ẹ̀ ni. Bẹ́ẹ̀ ni”. Kò ye Làbákẹ́ ìdí tí ojú fi ń tì í tó yìí níwájú agbẹjọ́rò náà.
1566,It might be because she was meeting him for the first time.,Ó lẹ̀ jẹ́ nítorí pé ó ṣẹ̀ṣẹ̀ ń pàdé rẹ̀ fún ìgbà àkọ́kọ́.
1567,It might be because those questions came dropping on her like bombshells. Or that her earlier conversation with the receptionist had weighed on her subconscious mind so much.,Ó lè jẹ́ pé àwọn ìbéèrè náà ń bá a lójijì bí i àdó olóró alùgbàù. Tàbí ìtàkurọ̀sọ òun pẹ̀lu olùgbàlejò ẹ̀ẹ̀kan ló dúró lọ́kàn rẹ̀ púpọ̀.
1568,"Well... Whatever the Reason, she just discovered she couldn't look her lawyer straight in the face.","Ẹhn... Ohunkóhun tí ì bá à fà á, ó kàn ṣàkíyèsí pé òun kò lè wojú agbejọ́rò rẹ̀ tààrà."
1569,"She answered all his questions dodging him, looking at the wall over his head, gazing at the fat books on the big shelf or looking down at the soft office rug.","Ó dáhùn gbogbo ìbéèrè rẹ̀ láìwojú rẹ̀, á wo ògiri èyìn rẹ̀, á wo àwọn ìwé ńlá ńlá tó wà lórí pẹpẹ ńlá tàbí kí ó gbójú sílẹ̀ máa wo rọ́ọ̀gì fẹ́lẹ́fẹ́lẹ́ ọ́fíìsì náà."
