English,Yoruba
Chief Kalejaiye explained that he was surprised that the rest of the land was occupied by hoodlums with construction of shanties on the land.,Olóyè Kalẹ̀jayé ní ó wá jẹ́ ohun ìyàlẹ́nu pe ìyókùn nínú ilẹ̀ náà ni àwọn ọmọ asùnta ti wá sọ ibẹ̀ di ibùgbé.
Chief Kalejaiye stated that the defence put up by those opposing the project that the land was allocated for market is untrue.,"O tako ìròyìn kan tóní wọn ti ya ilẹ̀ náà sọ́tọ̀ fún ilẹ̀ Ọjà, Kalẹjaye ní irọ́ pátápátá gbáni."
"The traditional ruler commended Governor Babajide Sanwo-Olu, Chairman Lagos Mainland Local government Mr Omolola Essien and Mr. Oladele Adekanye for their support for the programme.","Baálẹ̀ gbóríyìn fún Gómìnà Sanẃó-Olu, Alaga Dainland Abilékọ Ọmọlọlá Essien àti Ọ̀gbẹ́ni Adekanye fún àdúrótì wọn lórí ètò yìí."
The Lagos State Government has renewed calls for the conservation of wetlands resources in the state because they represent a critical past of the natural environment.,Ìjọba ìpínlè Èkó ti tún bẹ̀rẹ̀ ìtanijí lórí àwọn ilẹ̀ olómi fún àwọn nǹkan Àlùmọ́nì tó nbẹ nínú rẹ̀.
Mr Bello said that Lagos State is seizing the opportunity of the World Wetlands Day to sensitize Lagosians on the importance of wetlands calling for more community participation in wetlands management and conservation in the state.,"Ọ̀gbẹ́ni Bello ní ìpínlẹ̀ Èkó fi àsìkò yìí la àwọn ènìyàn lọ́yẹ̀ lórí iwúlò àti Àlùmọ́nì tó fi ara sin sínú omi, wọn w ápè àwọn àgbègbè tókùn kí wọn wá darapọ̀ mọ́ wọn nínú ìgbélárugẹ oun àlùmọ́nì tó fara sin sínú omi."
"He stressed that wetlands are a blessing to the communities where they exist because they serve as water reservoirs, fertile for food and vegetable production, handcrafts and shelter adding that they provide abodes for cultural, recreational and tourist activities.","O tẹ̀síwájú pé ìkẹ́ ni àwọn ilẹ̀ yìí jẹ́ fún àláàdúgbò tó bá wà nítorí pé ó dára fún Ọ̀gbìn ewébẹ̀, iṣẹ́ ọnà àti àwọn nǹkan mère mère míràn bíi ibi ìgbàfẹ́."
Mr. Bello stated that the state government would set up its monitoring and advocacy programmes and ensure stakeholders collaboration for the protection of the state’s wetland resources.,Ọ̀gbẹ́ni Bello ní ìjọba yóò dá ètò ìmójútó àti ìpolongo sílẹ̀ láti ríi pé àwọn ènìyàn jànkàn jànkàn láwùjọ yóò fọwọ́sowọ́pọ̀ pẹ̀lú wọn láti dáàbò bo oun alumoni ti ipinlẹ yii ri ninu omi.
"The Lagos State Chairman of Road Transport Employers Association of Nigeria, Alhaji Musa Muhammed has warned members of the association not to take advantage of the ban on okada and tricycles in some parts of the state to hike transport fare.",Alága ẹgbẹ́ àwọn awakọ RTEAN lórílè èdè yìí Alhaji Musa Mohammed ti kìlọ̀ fún àwọn Awakọ̀ láti máṣe gbé owó lé ọkọ̀ látàrí kíkó tí ìjọba kó kẹ̀kẹ́ Marwa kúrò nílẹ̀
He gave the warning in a statement issued in Lagos today said that any of its members that caught hike fare would be dealt with in accordance with the association law.,Ó sọ ọ̀rọ̀ yìí níbi tí ilé ẹ̀kó ìpoògùn ti ìjọba ìpínlẹ̀ Èkò tí wọn tún fi àmì ẹ̀ye dá Gómìnà lọ́lá tí òun naa sì tún se ìlérí pé òun yóò túnbọ̀ teramọ ìgbélárugẹ ètò ẹ̀kọ́.
The Senate has directed the Federal Airport authority of Nigeria to beef up security around all the airports in the country to check menace of drug trafficking and other security breaches.,Ilé ìgbìmọ̀ aṣòfin ti páláṣẹ fún àwọn ẹ̀ṣọ́ aláàbò ti pápákọ̀ òfurufú ti ìjọba Àpapọ̀ láti se ìmójútọ́ àti fífi ara balẹ̀ ṣe ìwáàdí àwọn tó n gbé egbògi olóró àti lẹ́ka mìíràn tí iṣè wọn jẹmọ́ o.
The Senate also urged the agency to always acknowledge only accredited personnel to be allowed in restricted areas of the airport.,Àwọn Aṣòfin ní àwọn tí àyẹ̀wò bá kún ojú òṣùwọ̀n nìkan lóní ẹ̀tó láti dúró láwọn agbègbè yìí.
"The Senate passed the resolution following a motion entitled the need to strengthen security at the airports sponsored by Senator Ibahim Olulegba as other seven lawmakers leading the debate on the motion, senator Olulegbe recalled how a Nigerian Zainab Aliyu was mistakenly arrested by the Saudi drug Enforcement Agency.","ilé ìgbìmọ̀ Aṣòfin buwó lu àbá tí Aṣòfin Ibrahim Olúlégba gbé sí iwájú wọn, tí àwọn aṣòfin méje mìí tún kín n lẹ́yìn, bákan náà lótún mú ẹnu ba ṣíṣì tí wọn ṣí Ọmọdébìrin Zainab Aliyu mú ní Saudi Arabia pé ó gbé egbògi olóró."
He expressed joy that Aliyu and two other Nigerians were saved from execution by the Saudi government due to the prompt interventions that proved that they had no knowledge of the drugs in their luggage.,Ò fi ìdùnnú rẹ̀ hàn bí orí ṣe kó Aliyu àti àwọn meji mìí yọ lọ́wọ́ ikú àìmọ̀dí lẹ́yìn ìwáàdí tó fìdí rẹ̀ múlẹ̀ pé wọn kòmọ bí egbògi olóró náà ṣe dé inú àpamọ́ wọn.
The continuation of the reconstruction of Lagos-Badagry expressway has begun.,Àtúnṣe ojúnà Àgbádárìgì ti tún bẹ̀rẹ̀.
"The Deputy Governor, Dr. Obafemi Hamzat flagged-off the next phase of the reconstruction of the road project at the Lagos International Trade Fair Complex along Badagry expressway, Lagos.",Igbákejì Gòmìnà Dókítà Ọbáfẹ́mi Hamsat ní àtúnṣe ọ̀hún bẹ̀rẹ̀ láti ọjà ńlá Trade fair lòjúnà márosè Àgbádárìgì.
Dr. Hamzat said the continuation of the next phase of the road re-construction would be between Agboju and the Lagos International Trade Fair.,Dókítà Hamsat ìṣíkejì ọ̀nà yóò láàrín Agboju sí traid fair.
He said that the road was to be extended from the original four lanes to ten lanes.,Ó ní ọ̀nà náà yóò fẹ̀ẹ̀ láti abala mẹ́rin tówà tẹ́lẹ̀ losí abala mẹ́ẹ̀wá.
He promised that the project would be completed by December this year.,Ó ṣe ìlérí pé àtúnṣe ọ̀wun yí parí nínú oṣù kejìlá ọdún.
"The Deputy governor however, appealed to road users in the state to show understanding and bear with the inconveniences the road construction might cause them.",lgbákejì Gómìnà rọ àwọn Awakọ̀ láti faradà ìnira tí àtúnṣe òhún le ma mú bá wọn .
He urged them to follow traffic rules and shun the act of driving against traffic otherwise known as ‘one way’ as this would result to traffic gridlock on the portion of roads where road users were meant to manage while the reconstruction last.,"Bákan náà ló ní kí wọn máa tẹ̀lé òfin kí wọ́n máṣe sáré àsápajúdé kí wọ́n sì rántí àwọn ẹlẹ́sè, kí àwọn ẹlẹ́sẹ̀ náà ó ṣẹ pẹ̀lẹ́-pẹ̀lẹ́ làsìkò àtúnṣe ọ̀nà yìí."
"The Deputy Governor also announced that the Federal Road Maintenance Agency, FERMA has collaborated with the Lagos State Government to reconstruct Igbor-Elerin to Agbara axis along the Lagos-Badagry expressway.",Ó fikún ọ̀rọ̀ rẹ̀ wí pé ìfọwọ́sowọ́pọ̀ tiwà láàrín àwọn òṣìṣẹ́ẹ́ Àjọ atún ọ̀nà ṣe tó jé ti ìjọba Àpapọ̀ láti ṣe àtúnse ọ̀nà igbó elérin jáde sí Àgbárá.
"In a remark, the Permanent Secretary, Ministry of Works and Infrastructure, Mr. Olujimi Hotonu, explained that ten years into the re-construction of the Lagos-Badagry expressway, LOT, which was Eri-Moore to Mile Two and LOT2A segment One, that is Mile Two to Agboju had been completed.","Akọ̀wé àjọ Amúṣẹ́ṣe dúpé, Ọ̀gbẹ́ni Olujimi Hotonu ní, láti bí ọdún méwàá sẹ́yìn ni ọ̀nà yí ti nílò àtúnṣe."
"Lagos State Chapter of the Peoples Democratic Party, PDP, has demanded full compensation for the families of the dead and injured in the latest boat capsize that occurred on the state water ways along Badare-Ikorodu route.",Ẹgbẹ́ òṣẹ̀lú People Democtic Party (PDP) ẹkà t‘èkó ti ní ó yẹ kí Ìjọba se ìrànwọ́ fún àwọn ebí àwọn èrò tó pàdánù èmí wọn nínú Ọkọ̀ ojú-omi ni Agbègbè Bádóre Ìkòròdú
"In a statement issued by the party’s spokesperson, Mr. Taofik Gani, said the party demanded a thorough probe into the remote causes of the mishap and any one culpable should face prosecution.","Nínú ọ̀rọ̀ ti Agbẹnusọ fún ẹgbẹ́ yìí, Ọ̀gbẹ́ni Taofik Gani ní Ẹgbẹ́ Òṣèlú bere fún ìwáàdí múnádóko lórí ìṣẹ̀lẹ̀ yíi."
The statement said avoidable boat carnage has become a serial occurrence in the state water-ways killing high numbers of people.,Ó fi ọ̀rọ̀ náà léde pé ọkọ̀ ojú omi tí ó ń dànù lemọ́lemọ́ ní ẹka ojú ọ̀nà orí omi ti ṣe ikú pa ọ̀pọ̀lọpọ̀ ènìyàn.
"It advised Governor Babajide Sanwo-Olu to declare a state of emergency in the state waterways adding that waterways ambulance, lighting, life jackets and qualified operators should be provided.","Báakan náà lótún gba Gómìnà Sanwó-Olú lámòràn láti pèsè àwọn ohun èèlò ààbò ìrìnnà ọkọ̀ ojú omi bí aṣọ ìdáàbòbò, ọkọ̀ ìdóòlà èmí àti iná ọba tó mọ́lẹ̀ rokoṣo pẹ̀lú àwọn akọ́ṣẹ́mọṣẹ́ awakọ̀ ojú omi."
The statement also called Governor Sanwo-Olu’s attention to various inadequacies which abound and manifest in the delivery of services to Lagosians.,Ó tẹ̀síwájú pé kí Gómìnà Sanwó-Olú mójútó àwọn kùdìẹ-kùdìẹ ní tó nkójú àwọn olúgbé ìpínlẹ̀ èkó.
The significance of entrepreneurs in economic development of a nation cannot be overemphasised.,Ipa ribiribi ní isẹ́ ọwọ́ àti Ọgbọ́n àtinúdá ń mú bá ìdàgbàsókè ọrọ̀ ajé.
"Director-General of Federal Radio Corporation of Nigeria, Dr. Monsur Liman, who was represented by the Director National Broadcast Academy, NBA, Mr. Abiola Ajbola, stated this during the opening ceremony of the Academy’s Batch B Basic Training at GRA Ikeja, Lagos.",Olùdarí Àgbà fún ilé Ẹ̀kọ ìgbóhùn sáfẹ́fẹ́ Arákùnrin Abíólá Ajíbólá tó tẹnumọ́ ọ̀rọ̀ yìí nígbà tó ń ṣojú Ọ̀gá Àgbà pátá-pátá fún ilé isé Rédíò Ìjọba Àpapọ̀ Dọ́kítà Maosur Liman níbi ètò tí wọ́n fi ṣíde ìgbẹ̀kọ́ ọ̀wọ́ kejì àwọn akẹ́ẹ̀kọ́ nípa ìgbóhùn sáfẹ́fẹ́ tó wáyé nínú ọgbà ilé ẹ̀kọ́ òhún ní GRA Ìkẹjà.
Mr. Ajibola who urged the students to strive hard to be self employed considering challenges facing the country pledged to organize a seminar on @opportunity in Digital space’ before the end of the nine weeks training exercise.,"Arákùnrin Ajibọla rọ àwọn Akẹ́ẹ̀kọ́ pé kí wọn ríi pé wọn ṣiṣẹ́ takuntakun láti ríi pé wọn dá iṣẹ́ ti ara wọn sílẹ̀ kí wọn leè kojú ìṣòro àíríṣẹ ṣe tó débá orílèdè yìí, Ó sì ṣe ìlérí pé òun yóò dá ìdánilẹ́ẹ̀kọ́ kan sílẹ̀ láàrin ẹ̀kọ́ ọlọ́sẹ̀ mẹ́sàn án tí wọn ń ṣe lọ́wọ́"
He noted that the Academy recognised excellence and warned students to shun cultism and other vices.,Bákan náà lótún rọ àwọn Akẹ́ẹ̀kọ́ láti jẹ́ Ọmọlúwàbí kí wọ́n siì jìnnà sí ẹgbẹ òkùnkùn nítorí pé ẹgbẹ́kẹ́gbẹ́ ń ba ìwà rere jẹ́.
"Also speaking, representative of NBA Registrar, who is also head of administration, Mrs. Nkiruka Okiche, highlighted some of the rules and regulations and advised them to adhere strictly to them",Nínú ọ̀rọ̀ ti Ọ̀gá Àgbà fún gbogbo ẹ̀ka Abílekọ Nkiruka Okiche lòun ti ka ìlànà òfin iléìwé ọhún sí ẹtíìgbọ́ wọn.
"In a remark, Director of Academic Planning, Mr. Tanko Abdullahi advised the students to leave up to expectations and imbibe the spirit of embarking on research to broaden their horizon.",Ọ̀gbẹ́ni Tanko Abdulahi tóun jẹ́ Ọ̀gá léka Ìgbẹ̀kọ́ naa gbà wọ́n níyànjú láti ní ẹ̀mí àti máa ṣe ìwádìí lóòrèkórè.
"Lagos State Governor, Mr. Babajide Sanwo-Olu has assured the delegation of the Football governing Body, FIFA, of maximum security, smooth transportation, accommodation and crowd management in Lagos if Nigeria wins the bid to host FIFA Under Twenty Female World Cup.","Gomina Sanwó –Olú ti fi ọwọ́ ṣọ̀yà fún àwọn Agbábọ́ọ̀lù ikọ̀ Fífà pé kí wọ́n lọ fi ọkàn balẹ̀ pé ètò ààbò tó péye, lóri lílọ-bíbọ̀ ní ìrọ̀rùn, ilé ìgbè tó fini lọ́kàn balẹ̀ àti ṣíṣe àkóso láàrin ogunlọ́gọ̀ ènìyàn, ní ìlú Èkó, tí orílèdè Nàíjíríà bá gbé gbá orókè láti ọwọ́ Àjọ FIFA pé kí wọn lọ ṣe kòkárí àti gba ìdíje àwọn ọmọbìnrin tí ọjọ́ orí wọn kòju ogún ọdún wá sílẹ̀ lọ"
"Governor Sanwo-Olu stated this when the inspection team from FIFA led by the President Nigeria football Federation NFF Amaju Pinnick paid him a courtesy visit at the Lagos House, Ikeja.",Ọ̀rọ̀ yìí ló jáde lásìkò tí àwọn ikọ̀ tí ń ṣàbẹ̀wò láti Àjọ FIFA tí alága àwọn agbábọ́ọ̀lù ní orílèdè yìí NFF Amaju Pinnik darí wọn lọ ṣe àbẹ̀wò sí gómìnà lọ́ọ́fìsì rẹ̀ ní Ìkẹjà.
"Nigeria has put forward the cities, Benin City, Asaba, Uyo for hosting the sixteen nations final.","Ó ní Ọriĺẹ̀-èdè yìí ti gbaradì fún eré Ìdárayá ẹlẹ́ẹ̀kẹrìndínlógún irú rẹ̀ tí wọ́n sì ti pèsè àyè sí ílu Benin city, Asaba àti Uyo."
"Governor Sanwo-Olu noted that with the population of over twenty million people the city of Lagos is full of energy, youthfulness and hospitable resourceful and dynamic people as one of the intended host cities for the competition.","Sanwó-Olú ní ìpínlè Èkó pẹ̀lú ẹgbẹlẹmùkú ènìyàn tó lé ní Ogún mílíònù óní ìlú Èkó ní agbára, àti àwọn Ọ̀dọ́ lọ́lọ́kan òjòkan àti ọ̀yàyà láti gba àlejò, gẹ́gẹ́ bí ìlú kan gbòógì tí wọ́nti yà sọ́tọ̀ fún ìdíje tó ń bọ̀ yìí."
"According to the Governor, the state is billed to host the biggest global music festival next year and this will further boost and project its tourism, entertainment and cultural potential.","Gómìnà, tún mú ẹnu ba ti ìpalẹ̀mọ́ Orin tó ń bò láìpẹ́ yìí, ó tún jẹ́ ọ̀nà ìmúgbòòrò ọrọ̀ ajé nípa ìrìn àjọ ìgbafẹ́."
"The President of NFF, Amaju Pinnick who thanked governor Sanwo-Olu for encouraging the Male Senior National Team during the last AFCON tournament, said the team is in Lagos to seek support of the government in taking football to the highest level.","Amaju Picnic tó jẹ́ Ààrẹ fún Ẹgbẹ́ agbábóòlù ilẹ́ wa dúpẹ́ lọ́wọ́ Gómìnà fún ọ̀rọ̀ ìyànjù oníyebíye tóbá àwọn agbábọ́ọ̀lù Ọkùnrin àgbà sọ, ó tún fi kún pé àwọn ikọ̀ yìí wá fún ìrànwọ̀ ìjọba láti jẹ́ kí eré ìdárayá bọ́ọ̀lú aláfẹsẹ̀gbá ó tún mú òkè si."
"Authors in the country have been called to join the wagon of promoting the history, culture and tradition through their works, so as to protect the heritage of the nation.","Àwọn Òǹkọ̀tàn wa ni wọ́n ti pè láti jígìrì kí Ìtàn, Àṣà àti Ìṣẹ̀ǹbáyé wa ó má bàá parun."
"This call was made by the Governor of Lagos State, Mr Babajide Sanwo-Olu at the launching of historical book, Matiku, at Akoka, Lagos.",Ọ̀rọ ̀ìrántí yìí ni Gómìnà Ìpínlẹ̀ Èkó Ọ̀gbẹ́ni Babájídé Sanwó-Olú pe gbogbo ènìyàn śi níbi ìfilọ́lẹ̀ ìwé mánigbàgbé kan tí wọ́n pè ní MÁTIKÚ tó wáyé ní Akọkà Yaba.
"Mr. Sanwo-Olu, who applauded the author of the book for focusing the book on the history of Lagos, noted that it will help call attention to the need to uphold what the state stands for which are excellence, peace, selflessness and unity.",Gomina dúpẹ́ lọ́wọ́ òǹkọ̀tàn yìí fún bí o ṣe kọ ìwé ọ̀hún nípa ìtàn Ìpínlẹ̀ Èkó ó tún ṣe ìlérí pé ìjọba yóò ma lé iwájú nínú Ìfẹ́ Ìṣọ̀kan àti ṣíṣe àgbélárugẹ àṣà.
"The Permanent Secretary of the Ministry of Tourism and Culture, Mrs. Abosede Adelafa who represented the Lagos state Governor said having a book that will serve as a reference material for the youth to know about the history, culture and tradition of Lagos is a step forward to support the effort of the government to protect the heritage of the state.","Abilékọ Abọ́sèdé Adélafà tó jé Akọ̀wé fún Àjọ elétò ìrìnàjò ìgbafé àti Àṣà tó lọ ṣojú Gómìnà níbẹ̀ ní gómìnà níìfẹ́ púpọ̀ śi ìwé tóbá ní ṣe pẹ̀lú ̀itàn nítorí pé lára ìrànwọ̀ àti jẹ́ kí àṣà wa ó le pé kárin kése ní, kó sì tún le ṣe àtìlẹ́yìn fún ìjọba."
"In an address, the author of the book, Mr. Elesin explained that it is the responsibility of all authors to fight history erosion through their works hence his decision to write the book to teach and draw attention to the true identity of Lagos.","Ṣé oníìkàn laajẹ́ ó ṣe, Oǹkọ̀tàn yìí Ọ̀gbéni Ẹlésin tó kọ ìwé yìí ní ojúṣe àwọn oǹkọ̀tàn ni láti má kọ ìtàn mánigbàgbé àti èròńgbà lórí ìwé yìí pé yóò se àfihàn ojúlówó ọmọ èkó tòóótó."
He also advised the youths not to forget their history as it is the source of their identity.,Bákán náà lótún rọ àwọn ọ̀dọ́ láti máṣe gbàgbé ìtán ibi tí wọ́n t́i ṣẹ̀ wá nítorí pé orírun wọn nìyẹn àti àmì ìdánimọ̀ wọn.
"The Presidential Election Petition Tribunal PEPT, will hold its inaugural session today at the Abuja Division of the Court of Appeal.",Ilé ẹjọ́ to ńgbọ́ ẹjó lẹ́yìn ìdìbò (PEPT) ni wọn yóò ṣe ìfilọ́lẹ̀ ìgbẹ́jọ́ ẹ̀ka ti olú ìlú Àbújá ní ilé ẹjọ́ kò tẹ́milọ́rùn.
"The Tribunal listed four petitions for mention,","Tí wọ́n sì ti to ẹjọ́ mérin tí wọ́n kọ́kọ́ fé gbọ́ sì́lẹ̀ ,"
"The first was filed by Hope Democratic Party, HDP and Mr. Ambrose Owuru, who claimed to be the party’s presidential candidate.","Àkọ́kọ́ ni ti Ẹgbẹ́ Òṣèlú Hope Democràtic Party (HPD) àti Ọ̀gbẹ́ni Ambrose Owuru, tó ń polongo ara rẹ̀ ní olùdíje fún Ààrẹ ẹgbẹ́ náà"
"The Second was filed by Peoples Democratic Party, PDP, and its candidate in the election Alhaji Atiku Abubakar.",Ẹlẹ́èkejì ni ti Ẹgbẹ́ Ọ̀ṣèlù (PDP) tí Alhaji Àtiku Abubakar sì jẹ́ Olùdíje fún ipo Ààrẹ.
The third was filed by the Coalition for Change and Mr. Jeff Ojinika who claimed to be the party’s presidential candidate.,"Coalition for Change ni ejọ́ tóun jẹ́ ẹlẹ́èkẹ́ta, tí Jeff Ojinika Ẹni tó ń polongo ararẹ̀ gẹ́gẹ́ bíi olùdíje Ààrẹ ẹgbẹ́ náà"
"The fourth petition was filed by the People’s Democratic Movement, PDM and Pastor Aminchi Habu who claimed to be the party’s presidential candidate.",Ìgbẹ́jọ́ tó ṣìkẹrin ni ti Ẹgbẹ́ People’s Democràtic Movement (PDM) eleyìí ti òjíṣẹ́ Olúwa Aminchi Abu tóun náà ń polongo ara rẹ̀ gẹ́gẹ́ bíi olùdíje fún ipò Ààrẹ ẹgbẹ́ náà
President Muhammadu Buhari has assured Nigerians that his government will not let them down in providing effective and result-oriented leadership that safeguard and ensures a better life for citizens.,"Ààrẹ Buhari ti tún fi ọwọ́ sọ̀yà pé òun ò ní já ọmọ Orílẹ̀ èdè yìí kulẹ̀ ní ìgbà kan-kan lórí Ìdánilẹ́èkọ́ nípá ìwùwà sí asájú, Ètò ààbò tó péye àti ìgbé ayé ìrọ̀rùn fún gbogbo Ọmọ ilẹ̀ yìí."
Speaking after attending the daily Tafsir Quranic Interpretations marking the months of Ramadan fast at the stated House Mosque President Buhari said he will keep working to deliver improved life for all Nigerians. A statement by his media aide Mallam Garba Shehu said the President expressed gratitude to all Nigerians for the opportunity to serve a second term in office.,Ọ̀rọ̀ yìí ni Aàrẹ sọ ní Mósháláshí ńlá tó wà Lábùjá lásìkò tí wọn ń sàmì oṣù Ramadan ó ní òun yóò ṣe Ìjọba tí yóò mú ìdẹ̀rùn bá Ọmo Ọrilé-èdè Nàìjíríà. Akọ̀ròyìn fún Àare wa Mallam Garba Ṣheu ní Àarẹ dúpẹ́ lọ́wọ́ gbogbo Ọmọ Nàìjíríà tí wọ́n fi àyè gba òun láti ṣiṣẹ́ sin ìlú lẹ́lẹ̀kejì.
The President urged Muslim faithful that discipline should be their watchword during this Ramadan.,Ààrẹ rọ àwọn Mùsùlùmí láti máa ní Ìkóra ẹni ní Ìjánu làsìkò lámú-lánà.
"In his remarks, the Chief Imam of the Mosque Sheik Abdulwaheed Suleiman called for prayers to curtail the current security challenges confronting the country.",Imam Mọshalashi yìí Sheik Abdul-Waheed Sulaimon naa tún pàrọwà fún ìrònúpìwàdà àti àdúrà kí orílẹ̀̀-edè wa ba lè ní ààbò tó peye.
"As the Eid-El-Kabir draws near, Lagosians have expressed their displeasure over the increase in prices of goods in the market which has made life unbearable for them.","Bí ọdún se n súnmọ́ ni àwọn olùgbé ìpínlẹ̀ Eko ti fajúro bí ojà se gbé owó lérí tó sì gaju agbára wọn lọ, tí kòsì mú ayé dẹrùn fún mùtúmùwà"
Some Lagosians who spoke with Bond FM said lack of fund to meet the excessive increase in prices of goods in the market has made survival difficult for them.,Lára àwọn ènìyàn tí ó bá iléṣe Bond FM sọ̀rọ̀ so pé ohun gbogbo ló gbe owó lórí kọ́já sísọ ní ọjà tí ósì jẹ́ kí àti la irúfẹ́ àkókò yìí kojá nira fún àwọn ènìyàn.
"They appealed to the government to put in place measures to ensure free-flow of money in the nation so as to boost economic activity, improving their standard of living.","Wọ́n rawọ́ ẹ̀bẹ̀ sí ìjoba Àpapọ̀ láti wá nǹkan ṣe síi, àtipé lílọbíbọ̀ owó láàrin ìlú leè jẹ́ kí ọrọ̀ ajé lọ sókè síi, ásì tún jẹ́kí ìgbé ayé ìdẹ̀rùn wà fún gbogbo mùtúmùwà."
"Akinrogun of Epe Land, Otunba Denge Anifowose has urged Nigerians to support President Muhammadu Buhari in his quest to transform the country.",Akínrógun ìlú Èpé Ọ̀túnba Dẹngẹ Anífowóṣe ti késí gbogbo ọmọ orílẹ̀-èdè yìí ĺáti sowópọ pẹ̀lú Ààrẹ Buhari fún ìyípadà rere fún ilẹ̀ wa.
He said that President Buhari has good intentions to make the country better which helped to win another election.,Ó ní èròńgbà àti tún ìlú ṣe èyí tó ṣe ìrànwọ́ fún un láti wọlé lẹ́lẹ́kèejì.
Otunba Anifowose said the second term of President Muhammadu Buhari would witness rapid development because he had laid a solid foundation for the country.,Ọ̀túnba Anífowóṣe ní sáà kejì yóò mú ìyípadà ọ̀tun wá bí Àarẹ ṣe ti fi ipa rẹ̀ lélẹ̀ fún orílèdè yìí.
"He also commended Lagosians for voting for Mr. Babajide Sanwo-Olu as Governor of the state, noted that Mr. Sanwo-Olu has experience and skills that would help the state to be an investors friendly.",Ó tún dúpẹ́ lọ́wọ́ àwọn olùgbé ìpínlẹ̀ Èkó bí wọ́n ṣe dìbò lópò yanturu fi gbé Gómìnà Sanwó-Olú wọlé àti pé gómìnà yìí ní ìmọ̀ ìjìnlẹ̀ láti leè ṣọ ìpínlẹ̀ Èkó di ìlú àpéwò fún àwọn Oníṣòwò.
Otunba Anifowosoe while wishing outgoing Governor Mr. Akinwunmi Ambode well in future endeavours said that Mr. Sanwo-Olu would continue from where he stopped to build on the legacy of the founding fathers of Lagos State.,"Ọ̀tùnba Dẹngẹ nígbà tó ń kí Gómìnà tó kógbá wọlé, ìyẹn Akinwunmi Ambọde pé ìtẹ̀síwájú rẹ̀ á dára àti pé Sanwó-Olú yóò ma tẹ̀síwájú nínú àlàálẹ̀ Asíwáju wọn."
"Plans are underway by the Lagos State Government, to a General Hospital in the Amuwo Odofin Council Area.",Ìjọba ìpínlẹ̀ Èkó ti ń ṣe ètò lábẹ́nú láti kọ́ ẹ̀kún ilé ìwòsán ìjọba tó wà ní ìdàgbàsókè Àmúwò-Ọdòfin.
"An Assistant Director of Medical Services at the State Health Service Commission, Dr. Olufunmilola Esho, stated this at a stakeholders meeting of the Amuwo-Odofin Maternal and Child Centre.",Igbá kejì Ọ̀gá àgbà àjọ elétò ìlera Dókítà Olúfúnmilọla Èṣhọ́ ló sọ ọ̀rọ̀ yìí níbi ìpàdé tó lọ ṣe ní́ ilé ìwòsàn yìí lẹ́ka ti ìgbẹ̀bí àti ọmọ wẹ́wẹ́ ‘
"A statement issued by Dr. Esho says, the state government was planning to build the hospital, so as to cater for the growing population of residents in the area.",Dókítà Ẹ̀shọ́ ní ìjọba ń gbèrò láti kọ́ ẹ̀kún ilé ìwòsàn yìí kí ó le tó lò fún àwọn olùgbé àgbègbè náà.
