English,Yoruba
Jordan warns of consequences as US withdraw Palestine aid,Jordan kìlò lórí ohun tó lè ṣẹlẹ̀ tí Amẹ́ríkà bá fòpin sí ìrànlọ́wọ́ Palestine.
Jordan’s foreign minister has warned of “dangerous consequences to regional stability” if the Palestinian refugee agency UNRWA cannot provide services to refugees.,"Mínístà fún ọ̀rọ̀ ilẹ̀ òkèèrè ni Jordan, ti ṣe ìkìlọ̀ pé ó léwu tí Amẹ́ríkà bá fòpin sí ìrànlọ́wọ́ yìí nítorí pé àjọ tó ń rísí ọ̀rọ̀ àwọn aṣàtìpó Palestine UNRWA kò ní agbára láti pèsè ohun tó yẹ fún wọn lásìkò yìí."
"The country which presently provides refuge to over two million refugees from troubled middle eastern states said the move represents a major hit for the agency, as the US had long been its biggest donor.","Báyìí, ó lé ní mílíọ́nù méjì aṣàtìpó tí wọn ń sàtipo láti àárín gbungbùn ilà oòrùn ní èyí tí yóò yọ sílẹ̀ ní kété tí Amẹ́ríkà bá ti yọwọ́ kúrò."
Foreign Minister Ayman Safadi said that Amman regrets Washington’s decision to cut funding for the United Nations Relief and Works Agency for Palestine (UNRWA).,Ayman Safadi tó jẹ́ mínísítà fún ilẹ̀ òkèèrè ni ó bani lọ́kàn jẹ́ pé Washington yọwọ́ owo ìrànwọ́ ìrànlọ́wọ́ Àjọ ìṣọ̀kan Àgbáyé àti Iṣẹ́ (UNRWA) tí wọ́n ń pèsè fún Palestine.
The minister also said that his country will continue to rally for donor support to help ease the financial strain that the agency is currently facing.,Mínísítà náà ní ìjọba yóò túbọ̀ máa gbìyànjú láti máa wa àwọn olùrànlọ́wọ́ míràn láti fòpin sí ìṣòro tí àjọ náà ń kojú báyìí fún owó níná.
"---Meanwhile, Israeli Intelligence Minister Israel Katz praised “the decision of the president of the United States to halt all funding of UNRWA – the body that enshrines the Palestinian refugee problem.”","---Ohun tó kọ iwájú sí ẹnìkan ni ọ̀rọ̀ náà nítorí mínísítà ọ̀tẹlẹ̀múyẹ́ fún Isreal, Isreal Katz yòmbó ìgbésẹ̀ Ààrẹ Amẹ́ríkà láti dá gbogbo owó ìrànwọ́ àjọ UNRWA – t’ó ń ṣàfikún sí ìṣoro àwọn ogúnléndé Palestine."
"UNRWA, which began operations in 1950, assists some five million Palestinian refugees, according to its website.","Àjọ UNRWA, tí ó bẹ̀rẹ̀ iṣẹ́ láti ọdún 1950 ní èyí tí ó ti pèsè ìrànlọ́wọ́ fún ó lè ní mílíọ́nù márùn-ún ogúnléndé Palestine."
"Nigeria, Germany, UN hold conference on Boko haram","Nàìjíríà, Germany àti UN yóò ṣèpàdé lórí ikọ̀ ọlọ́tẹ̀ Boko haram."
"Nigeria, Germany, Norway, and the United Nations have converged on Berlin, on Monday for a “pledging conference on boko haram”.","Orílẹ̀-èdè Nàìjíríà, Germany, Norway, àti àjọ àgbáyé (United Nàtions)ti pàdé ní Berlin, lọ́jọ́ Ajé láti “ṣèpàdé lórí ikọ̀ ọlọ́tẹ̀ boko haram""."
"The Berlin Conference, holding from Sept. 3 to 4, is jointly organized by the three countries and the UN, and is one of the 2018 largest pledging conferences for the Lake Chad region.","Ìpàdé ti yóò wáyé ni Berlin láti ọjọ́ kẹta sí ìkẹrin lo jẹ́ pé àwọn orílẹ̀-èdè mẹ́ta àti àjọ àgbáyé (UN) ló ṣe onígbọ̀wọ́ rẹ̀, ìpàdé ọ̀hún ní èyí tí ó lágbára jùlọ lọ́dún 2018 fún ẹ̀kùn Lake Chad."
"The conference will focus on humanitarian assistance, civilian protection, crisis prevention and stabilization for the region, as well as seek to raise funds for the humanitarian requirements totaling $1.56 billion.",Ìpàdé náà ni yóò dá lórí pípèsè ètò ìrànwọ́ owó mílíọ́nù kan lé ní mẹ́rìndínlọ́gọ́ta dọ́là fún àwọn ẹ̀kùn ti ọ̀fọ̀ ṣẹ̀ sí àti pípèsè ètò ààbò.
"The pledges at the conference, would help provide humanitarian assistance for the Northeast Nigeria and parts of Niger, Chad and Cameroon, ravaged by Boko Haram insurgents.","bákan náà ni ìpàdé yìí yóò tún pèsè ètò ìrànwọ́ fún àwọn ẹ̀kùn Ìlà -oòrùn Àríwá lórílẹ̀-èdè Nàìjíríà àti apá ibìkan lórílẹ̀-èdè Niger, Chad àti Cameroon tí ikọ̀ Boko Haram ti ṣọṣẹ́ sí."
"It would also discuss the perspectives of civil society, their concerns and contributions, as well as how to strengthen collaboration between the affected countries and organizations involved in responding to the crisis.","Níbi ìpàdé náà ni, wọn yóò tún máa jíròrò nípa èròǹgbà, ìmọ̀ràn àti ìrànwọ́ láti ọ̀dọ àwọn ilé-iṣẹ́ tí kì í ṣe ti ìjọba àti ọ̀nà tí wọn yóò gbà láti máa fọwọ́sowọ́pọ̀ pẹ̀lú àwọn orílẹ̀-èdè tí àjálù náà kọlù àti àwọn ẹgbẹ́ tí wọ́n ti ń pèsè ètò ìràwọ́ fún àwọn orílẹ̀-èdè wọ̀nyí."
"The Nigerian delegation to the Berlin conference is being led by Nigeria’s Ambassador/Permanent Representative to the UN, Prof. Tijjani Bande.","Ọ̀jọ̀gbọ́n Tijjani Bándé, t’ó jẹ́ aṣojú orílẹ̀-èdè Nàìjíríà ní àjọ UN ló ṣojú orílẹ̀-èdè Nàìjíríà níbi ìpàdé náà tó wáyé ní Berlin."
"The Nigerian envoy said recently that Nigeria had developed a 6.7-billion-dollar robust plan of action for the reconstruction, rehabilitation and resettlement of Northeast, devastated by Boko Haram activities.",Aṣojú orílẹ̀-èdè Nàìjíríà ní orílẹ̀-èdè Nàìjíríà ti ṣètò ìlànà owó tó lé ní bílíọ́nù méje dọ́là láti fi ṣàtúnṣe sí àwọn ẹ̀kùn tí ikọ̀ boko Haram bàjẹ́.
"He stressed the need for collaboration and cooperation among countries of the Lake Chad, the donors, as well as humanitarian and development partners.",Ó sọ pé ìfọwọ́sowọ́pọ̀ àti ìbáṣepọ̀ láàárín àwọn orílẹ̀-èdè tó wà ní lake Chad àti àwọn tí yóò pèsè ètò ìrànwọ́ ṣe pàtàkì púpọ̀.
"Lake Chad Basin, must provide facilitation of occupational opportunities, job creation, skill acquisition and others, are central to finding lasting solution to the problem in the region.","Àwọn ẹ̀kùn Lake Chad gbọ́dọ̀ le è pèsè ohun amáyédẹrùn, iṣẹ́ lọ́pọ̀ janturu àti iṣẹ́ kíkọ́, lọ́nà tí yóò fi dín wàhálà t’ó ń ṣẹlẹ̀ ní àwọn ẹ̀kùn náà kù."
"To realize all these would entail our collective commitment to a broad range of actions, facilitated by strong international cooperation and partnership, involving the UN agencies and development partners, like the World Bank and African Development Bank, among others.","Láti le ṣe àṣeyorí nípa àwọn ètò ìdàgbàsókè wọ̀nyí, àjọ àgbáyé bí i ilé ìfowópamọ́ àgbáyé, ilé ìfowópamọ́ ti orílẹ̀-èdè Áfíríkà àti àwọn ilé-iṣẹ́ mìíràn ti ṣetán láti ṣètò ìrànlọ́wọ́ fún àwọn orílẹ̀-èdè yìí, tí wọ́n bá lèe fọwọ́sowọ́pọ̀ láti le gbógun ti àwọn ìṣòro tó ń dojú kọ wọ́n."
The UN had also said that it would have provided assistance to no fewer than 6.1 million people affected by the Boko Haram crisis in Northeast Nigeria by the end of 2018.,"Àjọ UN ti ní òun yóò pèsè ètò ìràwọ́ fún àwọn tí iye wọn lé ní mílíọ́nù mẹ́fà lorílẹ̀-èdè Nàìjíríà , tí ikọ̀ Boko Haram kọlù ní ẹ̀kùn Ìlà -oòrùn Àríwá  lorílẹ̀-èdè Nàìjíríà kí ọdún 2018 ó tó parí."
"UN Resident and Humanitarian Coordinator for Nigeria, Mr Edward Kallon, said at a recent event in New York, that Nigeria was still facing a crisis of global magnitude.","Edward Kallon, t’ó jẹ́ aṣojú àjọ UN ni ẹ̀ka ètò ìrànwọ́ fún orílẹ̀-èdè Nàjíríà sọ̀rọ̀ ní New York níbi ìpàdé kan pé orílẹ̀-èdè Nàìjíríà ń kojú àwọn ìṣòro púpò."
"Over 10.2 million people affected in three states in Northeast Nigeria, 7.7 million people in need of humanitarian assistance.",Ó lé ní mílíọ́nù mẹ́wàá àwọn ènìyàn tó wà ní ìpínlẹ̀ mẹ́ta lorílẹ̀-èdè Nàìjíríà tó wà ní ẹ̀kùn Ìlà -oòrùn Àríwá tí wọ́n nílò ètò ìrànwọ́.
"August 30, 2018 --- Lagos state governor host Britain Prime Minister","August 30, 2018 --- Gómìnà ìpínlẹ̀ Èkó gba adarí ìjọba Britain lálejò."
"Lagos state governor, Akinwunmi Ambode host Britain Prime Minister Theresa May, he told him that Lagos state is a place where investors settled.","Gómìnà ìpínlẹ̀ Èkó, Akínwùnmí Ambode gba adarí ìjọba orílẹ̀-èdè Britain, Theresa May lálejò , ó sọ fún un pé ìpínlẹ̀ Èkó jẹ́ ibi tí àwọn oníṣòwò tẹ̀dó sí."
"The Governor show his happiness to welcome Britain Prime minister, He said the relationship between Nigeria and Britain has being for long.","Gómìnà fi ìdùnnú rẹ̀ hàn láti tẹ́wọ́ gba adarí ìjọba orílẹ̀-èdè Britain ni àlejò, ó só pé ìbáṣepọ̀ tó wà láàárín orílẹ̀-èdè Nàíjíríà àti Britain ti wà láti ọjọ́ pípẹ́."
"He said education, culture and the governance Nigerians are practicing, was leant from Britain.","Ó ní ìmọ̀ ẹ̀kọ́, àṣà, ìṣèlú ti àwọn ọmọ orílẹ̀-èdè Nàìjíríà ń múlò, ló jẹ́ pé láti orílẹ̀-èdè Britain ni wọ́n ti kọ́ọ."
"Ambode added that a good place to invest, Lagos state allow investors to invest most especially they have a stable government as the economy of Lagos is big as compared to the population in Lagos, regard for the law and stable judgment.","Ibi tí ó dára láti dá okoòwò sílẹ̀, Ambode fi kún ọ̀rọ̀ rẹ̀ pé, ìlú Èkó fi ààyè gba àwọn oníṣòwò láti dá ilé-iṣẹ́ wọn sílẹ̀, pàápàá jùlọ ,wọ́n ní ètò  ìṣèjoba tí ó fẹsẹ̀ múlẹ̀, bí ètò ọrọ̀-ajé ìlú Èkó ṣe tóbi púpọ̀ sí, iye àwọn ènìyàn tó ń gbé inú ìlú náà, ìbọ̀wọ̀ fún òfin àti ètò ìdájọ́ tó fẹsẹ̀ múlẹ̀."
He said “we deliberated with Britain government most especially on how the Britain investors will bring development to Lagos economy.,"Ó sọ pé “a jíròrò pẹ̀lú adarí ìjọba orílẹ̀-èdè Britain, pàápàá jùlọ lórí bí àwọn oníṣòwò orílẹ̀-èdè Britain yóò ṣe mú ìdàgbàsókè bá et̀ò okoòwò nílùú Èkó."
As you know that is a place where investors settled in Nigeria.,Gẹ́gẹ́ bí ẹ ṣe mọ̀ pé ìlú Èkó ni ibi tí àwọn oníṣòwò gúnlẹ̀ sí lorílẹ̀-èdè Nàìjíríà.
Many Britain citizen have business in Lagos.,Ọ̀pọ̀ àwọn ọmọ orílẹ̀-èdè Britain ló ní okoòwò nílùú Èkó.
"‘Governor also said as May came into Lagos, it will allow more business and security development.","""Gómìnà tún sọ pé bí May ṣe wá sílùú Èkó, yóò tún jẹ́ kí ètò okoòwò àti ààbò tún ní ìdàgbàsókè sí i."
"He said Britain citizen have the opportunity to partake in many businesses in Lagos, as empowerment, technology, finance, social amenities and companies.","Ó ní àwọn ọmọ orílẹ̀-èdè Britain ní àǹfààní láti lọ́wọ́ nínú ọ̀pọ̀lọpọ̀ okoòwò tó wà nílùú Èkó, bi i ètò agbára, ìmọ̀ ẹ̀rọ, ètò ìṣúná owó, ohun amáyé-dẹrùn àti ilé–iṣẹ́."
Lagos has been taking many steps to encourage investors to invest.,Ọ̀pọ̀lọpọ̀ ìgbésẹ̀ ni ìlú Èkó ti ń gbé láti mú ohun ìwùrí dé bá àwọn oníṣòwò láti dá okoòwò sílẹ̀.
"We have much work done on judiciary, and Britain Prime Minister was happy with this.","Ọ̀pọ̀lọpọ̀ iṣẹ́ lati ṣe, lórí ètò ìdájọ́, inú adarí ìjọba orílẹ̀-èdè Britain sì dùn sí eléyìí."
"He is ready to support us, to help money lending program and development on finance.",Ó sì ti ṣetán láti ṣe àtìlẹyìn fún wa láti ṣèrànwọ́ ètò èyáwó àti ìdàgbàsókè lórí ètò ìnáwó.
The governor said he will try to all within his capacity to establish the relationship between Lagos state and Britain the more.,"""Ètó ìbáṣepọ̀ Gómìnà sọ pé ìjọba òhun yóò gbìyànjú láti ṣe ohun tó wà níkàwọ́ọ́ rẹ̀ láti túbọ̀ feṣè ìbáṣepọ̀ tó wà láàárín ìlú Èkó àti Britain múlẹ̀ sí i."
"He said ‘we have spoken on technology, social amenities and investment.","Ó sọ pé ‘a ti sọ̀rọ̀ nípa ìmọ̀ ẹ̀rọ, ohun amáyédẹrùn àti ìdásílẹ̀ ilé-iṣẹ́."
The relationship between Lagos state and Britain started many years back.,Ìbáṣepọ̀ tó wà láàárín ìlú Èkó àti orílẹ̀-èdè Britain bẹ̀rẹ̀ láti ọ̀pọ̀lọpọ̀ ọdún ṣ́eyìn.
"As you know, Lagos was made the capital city by the Britain during the time of the colonial masters, that is why we must see that many businesses from Britain must be in Lagos.","Bí ẹ ti mọ̀ pé, ìlú Èkó ni orílẹ̀-èdè Britain fi ṣe olú-ìlú lásìkò ìjọba amúnisìn, Ìdí nìyí tí a gbọ́dọ̀ ṣe ri i pé ọ̀pọ̀lọpọ̀ okoòwò láti orílẹ̀-èdè Britain ló gbọ́dọ̀ wà nílùú Èkó."
Britain Prime Minister went round Lagos and he is ready to collaborate with us to allow the Britain citizen invest more business in Nigeria.,"Adarí ìjọba orílẹ̀-èdè Britain ti lọ yíká ìlú Èkó, ó sì ti ṣetán láti tún fọwọ́sowọ́pọ̀ pẹ̀lú wa, láti tún jẹ́ kí àwọn ọmọ orílẹ̀-èdè Britain tún dá okoòwò sílẹ̀ si i."
"The Britain Prime Minister has shown his happiness when speaking with news men at the airport in Lagos, that he is happy to come to Nigeria especially to Lagos to see how companies are successful.","""Adarí ìjọba orílẹ̀-èdè Britain fi ìdùnnú rẹ̀ hàn nígbà tí ó ń bá àwọn akọròyìn sọ̀rọ̀ ni pápá bàálù tó wà nílùú Èkó, pé inú òhun dùn láti wá sí orílẹ̀-èdè Nàìjíríà pàápàá jùlọ sí ìlú Èkó láti rí bí àwọn ilé iṣẹ́ ṣe ń ṣe àṣeyọrí."
"He said ‘I am happy to come to Nigeria especially Lagos, a good relationship is between Nigeria and Britain and we have a lot of things to do in the future.","Ó sọ pé “Inú mi dùn láti wá sí orílẹ̀-èdè Nàìjíríà, pàápàá jùlọ sí ìlú Èkó, ìbáṣepọ̀ tó dán mọ́nrán wà láàárín orílẹ̀-èdè Nàìjíríà àti Britain, a sì ní ọ̀pọ̀lọpọ̀ nǹkan pàtàkì láti ṣe lọ́jọ́ iwájú."
"I enjoyed Abuja and Lagos, and I’m happy with the successful economy there.","Mo gbádùn ìlú Àbújá àti Èkó, inú mi sì dùn bi ètò ọrọ̀-ajé ṣe ń ṣe àṣeyọrí níbẹ̀."
"We want the economy of Nigeria and UK to develop, and invest many businesses in Nigeria, businesses in Britain will be useful in Nigeria.","“A fẹ́ kí ìdàgbàsókè bá ètò ọrọ̀-ajé orílẹ̀-èdè Nàìjíríà àti Uk, kí a dá ọ̀pọ̀lọpọ̀ iṣẹ́ sílẹ̀ lorílẹ̀-èdè Nàìjíríà, iṣẹ́ tó wà lorílẹ̀-èdè Britain yóò wúlò lorílẹ̀-èdè Nàìjíríà."
I thank the Governor of Lagos state.,Mo dúpẹ́ lọ́wọ́ gómìnà ìpínlẹ̀ Èkó.
“He said Lagos state did so well to encourage investors in the state.,"’’Ó ní ìlú Èkó ti ṣe gudugudu méje, yàyà mẹfà láti leè mú ìwúrí bá àwọn oníṣòwò ní ìpínlẹ̀ náà."
Mrs. May said they have made provision to borrow about seven hundred and fifty million Pound Sterling that Lagos state can benefit from.,"Arábìnrin May, sọ pé àwọn ti ṣètò èyáwó tí iye rẹ̀ tó mílíọ́nù ẹ̀ẹ́dẹ́gbẹ̀rinléláàdọ́ta owó pọ́ùn tí ìlú Èkó náà sì le è jẹ àǹfààní rẹ̀."
Britain Prime Minister also said she came with her group who are engineers which Lagos state can benefit from.,"Adarí ìjọba orílẹ̀-èdè Britain tún sọ pé òun wà pẹ̀lú àwọn aṣojú rẹ̀ tó ní ìmọ̀ ẹ̀rọ, ní èyí tí ìlú Èkó lèe jẹ àǹfààní rẹ̀."
"Investing business, she also said Britain is ready to assist Lagos state on business and that the jacket she was wearing was made in Nigeria.",Dídá okoòwò sílẹ̀. Ó tún sọ pé orílẹ̀-èdè Britain ti ṣetán láti ran ìlú Èkó lọ́wọ́ nípa ètò okoòwò àti pé orílẹ̀-èdè Nàìjíríà ni wọ́n ti ṣe aṣo jáákẹ́tì tí òun ń wọ̀.
"Part of those that came to welcome the Prime Minister at expertly 4:30pm in the evening at the airport are, Governor and his Deputy, Dr. Oluranti Adebule and the secretary to the state government, Mr. Tunji Bello and the special assistance to the government and the director of foreign affairs Prof. Ademola abass.","Lára àwọn tó wá pàdé adarí ìjọba orílẹ̀-èdè Britain nígbà tó dé sí pápá ọkọ̀ òfuurufú ní déédé aago mẹ́rin àbọ̀ ọ̀san, ni gómìnà àti Igbákejì Gómìnà, Ọ̀mọ̀wé Olúrántí Adébulé, akọ̀wé ìjọba ìpínlẹ̀, Ọ̀gbẹ́ni Túnjí Bello àti olùrànlọ́wọ́ pàtàkì ìjọba àti olùdarí ọ̀rọ̀ t’ó jẹ mọ́ ti ilẹ̀ òkèère, ọ̀jọ̀gbọ́n Adémọ́lá Abass."
---President Buhari had an indoor meeting with Britain Prime Minister.,---Ààrẹ Buhari ṣe ìpàdé bòńkẹ́lẹ́ pẹ̀lú Adarí ìjọba orílẹ̀-èdè Britain.
"The president of Nigeria Muhammadu Buhari and Britain Prime Minister, Theresa May had an indoor meeting at the presidential house in Abuja.","Ààrẹ orílẹ̀-èdè Nàíjíríà Muhammadu Buhari àti Adarí ìjọba orílẹ̀-èdè Britain, Theresa May ṣe ìpàdé bòńkẹ́lẹ́ nílé Ààrẹ t’ó wà nílùú Àbújá."
"The meeting started at the office of the president at the state house, the moment May came to the state house at expertly 12:00noon.","Ìpàdé náà bẹ̀rẹ̀ ní ófíísì ile Ààrẹ, ní kété tí May dé sí ilé–Ààrẹ ní déédé aago méjìlá ọ̀sán."
President Buhari and Directors at the federal government offices came to welcome May.,Ààrẹ Buhari àti àwọn Adarí ilé-iṣẹ́ ìjọba àpapọ̀ ni wọ́n wá pàdé May.
The meeting will be on the how to establish the Nigeria and Britain relationship.,Ìpàdé náà ni yóò dá lórí ọ̀nà tí ìbáṣepọ̀ orílẹ̀-èdè Nàìjíríà àti Britain yóò ṣe túbọ̀ fẹsẹ̀ múlẹ̀ sii.
These two nations will sign a memorandum of understanding on security and development.,"Orílẹ̀-èdè méjèèjì yìí, ni yóò tún máa tọwọ́bọ ìwé ìgbọ́ra-ẹni yé (ìbáṣepọ̀) lórí ètò ààbò àti ìdàgbàsókè."
Nigeria is part of the Nations May want to visit in Africa.,Orílẹ̀-èdè Nàìjíríà wà lára orílẹ̀-èdè tí May fẹ́ kàn sí nílẹ̀ Áfíríkà.
---Turkey lock up suspects because of the attack on the American embassy.,---Turkey ti àwọn afurasí mọ́lé látàrí ìkọlù sílé aṣojú orílẹ̀-èdè Améríkà.
"Turkish police force has arrested another two suspects on the accusation that, they are part of those that attacked United State embassy which came on Monday at the capital of the country which is Ankara.","Ilé-iṣẹ́ ọlọ́pàá lórílẹ̀-èdè Turkey tún ti mú àwọn afurasí méjì mííràn látàrí ẹ̀sùn tí wọ́n fi kàn wọ́n pé, wọ́n lọ́wọ́ sí ìkọlù sílé aṣojú orílẹ̀-èdè Amẹ́ríkà (United States embassy) èyí tí ó wáyé lọ́jọ́ Ajé ní olú-ìlú orílẹ̀-èdè ọ̀hún tí ń ṣe Ankara."
"According to the news, those concerned said the attacked was possibly from the NATO militant.","Gẹ́gẹ bí ìròyìn ṣe sọ, ìkọlù náà ni àwọn tọ́rọ̀ kàn sọ pé, ó ṣeéṣe kó jẹ́ pé àwọn ọmọ ogun ọlọ́tẹ̀ NATO ni ó wà nídì rẹ̀."
Now total number of suspects in detention is four with the two suspect that just joined them.,"Ni báyìí, àpapọ̀ àwọn afurasí tí ó wà nínú àtìmọ́lé jẹ́ mẹ́rin pẹ̀lú àwọn méjì tí ó ṣẹ̀ṣẹ̀ darapọ̀ mọ́ wọn."
The police force said two out of the suspects were drunk during the attack.,"Ilé-iṣẹ́ ọlọ́pàá sọ pé, méjì nínú àwọn afurasí náà mu otí àmupara lásìkò ìkọlù náà."
It was also established that no one was injured in the attack.,"Ẹ̀wẹ̀, ìròyìn tún fi múlẹ̀ pé ẹnikẹ́ni kò farapa nínú ìkọlù náà."
---Two people die at the screen sport competition in Florida.,---Àwọn ènìyàn méjì ni ó kú níbi ìdíje eré ìdárayá orí ẹ̀rọ agbáwòrán ní ìpínlẹ̀ Florida.
"One participant in the screen sport competition in Jacksonville, Florida, in America has killed himself after shut two people who died immediately.","Olùkópa kan nínú ìdíje ere-ìdárayá orí ẹ̀rọ agbáwòrán nílùú Jacksonville, ní ìpínlẹ̀ Florida, lórílẹ̀-èdè Amẹ́ríkà tí gbẹ̀mí ara rẹ̀ lẹ́yìn tí ó yìnbọn mọ́ ènìyàn méjì tí wọ́n sí pàdánù ẹ̀mí wọn lẹ́sẹ̀kẹsẹ̀."
"According to the police, the name of the suspect is David Katz, twenty-four years old who is in Baltimore.","Gẹ́gẹ bí ilé-iṣẹ́ ọlọ́pàá ṣe sọ, wọ́n ní, orúkọ afurasí ọ̀hún ń jẹ́ David Katz, ọmọ ọdún mẹ́rìnlélógún tí ó wá láti ìlú Baltimore."
"So also, eleven more people were brutally injured at the recreation center around Jacksonville on Sunday.","Bákan náà, ènìyàn mọ́kànlá mìíràn tún farapa yánayàna ní gbàgede ìgbáfẹ́ lágbègbè Jacksonville lọ́jọ́ Àìkú (Sunday)."
"According to eye witness, it was established that, Katz was angry because of his failure to win the American football eSport event which made him to misbehave.","Gẹ́gẹ́ bí àwọn tí ìṣẹ̀lẹ̀ ọ̀hún ṣojú wọn, wọ́n fi múlẹ̀ pé, inú ló bí Katz látààrí pé kò jáwé olúborí nínú ìdíje bọ́ọ̀lù Amẹ́ríkà ọ̀hún (American football eSports event), ní èyí tí ó mú wu ìwà lọ́nà àìtọ́."
"Now, the names of those injured in the incident are yet to be announced, until they pardoned their families, though some people have been showing concern on the esport event website.","Ní báyìí, wọn kòì tíì kéde orúko àwọn tí ó fara kááṣá ìjàmbá náà, di ìgbà tí wọ́n bá tó fojúri àwọn ẹbí wọn, bí ó ti lè jẹ́ pé àwọn mìíràn tí ń ṣèdárò lórí ibùdó-ìtakùn esport."
"Different accident is happening in Florida about some years ago, and the incident that occurred around the Pulse night club in Orland in the year 2016, the incident that killed forty nine people, also the incident that killed seventeen people in Marjory Stoneman Douglas School around Parkland in February this month.","Oríṣiríṣi ìjàmbá ló tí ń wáyé ní ìpínlẹ̀ Florida láti ọdún mélòó kan ṣẹ́yìn, tí ó fi mọ́ ìjàmbá tí ó wáyé ní gbàgede ìgbáfẹ́ alẹ́ nílùú Orlando lọdún 2016 (Pulse nightclub), ìṣẹ̀lẹ̀ tí ó ṣekú pa ènìyàn mọ́kàndínláàdọ́ta, bẹ́ẹ̀ sì ni ìṣẹ̀lẹ̀ tí ó tún ṣekú pa ènìyàn mẹ́tàdínlógún nílé ìwé Marjory Stoneman Douglas ní agbègbè Parkland nínú oṣù kejì oṣù yìí."
---Iran promised to support the reformation of Syria.,---Iran ṣèlérí láti ṣàtìlẹyìn fún àtúnṣe orílẹ̀-èdè Syria.
"Iran has decided to fulfill her promise in a way to support the reformation in Syria through the provision of budget, an established politics and the support for the soldiers.","Orílẹ̀-èdè Iran ti ṣèpinnu láti mú ìlérí rẹ̀ ṣẹ lójúnà láti sàtìlẹyìn fún àtúnṣe orílẹ̀-èdè Syria nípasẹ̀ pípèsè ètò ìṣúná, òṣèlú tí ó fẹsẹ̀ múlẹ̀ àti àtìlẹyìn ikọ̀ ọmọ ogun."
"Amir Hatami who is the Minister in charge of security in Iran told the news men during his meeting with the Syrian President Bashar al-Assad and Minister for defense in the country, Ali Abdullah Ayyoub.","Amir Hatami tí ó jẹ́ Mínísítà tó ń mójútó ètò ààbò lorílẹ̀-èdè Iran ló jábọ̀ ọ̀rọ̀ náà fún àwọn akọròyìn lásìkò ìpàdé rẹ̀ pẹ̀lú Ààrẹ orílẹ̀-èdè Syria Bashar al-Assad àti Mínísítà tó ń mójútó ètò ààbò, Ali Abdullah Ayyoub lórílẹ̀-èdè náà."
"The two nations had agreement to collaborate on the reformation of Syria, and will not allow other nation to partake in the reformation.","Orílẹ̀-èdè méjèèjì jọ ní àdéhùn pé wọn yóò jọ fọwọ́sowọ́pọ̀ mú àtunṣe bá ilẹ̀ Syria, tí wọn kò sì ní fàyè gba orílẹ̀-èdè mìíràn láti lọ́wọ́ sí àtunṣe ọ̀hún."
